{
  "$schema": "./level-schema.json",
  "id": 0,
  "chapterId": 0,
  "name": "The Calling",
  "description": "Finn's quiet morning is interrupted by urgent news. The Hearthhold needs him.",
  "bounds": {
    "width": 2400,
    "height": 600
  },
  "spawn": {
    "x": 100,
    "y": 200
  },
  "exit": {
    "x": 2300,
    "y": 150,
    "width": 100,
    "height": 200,
    "targetChapter": 1
  },
  "platforms": [
    {
      "id": "ground_main",
      "x": 0,
      "y": 0,
      "width": 2400,
      "height": 100,
      "type": "solid",
      "material": "grass"
    },
    {
      "id": "cottage_floor",
      "x": 50,
      "y": 100,
      "width": 300,
      "height": 20,
      "type": "solid",
      "material": "wood"
    },
    {
      "id": "fence_1",
      "x": 400,
      "y": 100,
      "width": 150,
      "height": 60,
      "type": "solid",
      "material": "wood"
    },
    {
      "id": "stepping_stone_1",
      "x": 600,
      "y": 130,
      "width": 80,
      "height": 30,
      "type": "solid",
      "material": "stone"
    },
    {
      "id": "stepping_stone_2",
      "x": 720,
      "y": 160,
      "width": 80,
      "height": 30,
      "type": "solid",
      "material": "stone"
    },
    {
      "id": "bridge_start",
      "x": 850,
      "y": 100,
      "width": 400,
      "height": 20,
      "type": "solid",
      "material": "wood"
    },
    {
      "id": "river_bank_1",
      "x": 1300,
      "y": 100,
      "width": 200,
      "height": 50,
      "type": "solid",
      "material": "stone"
    },
    {
      "id": "willow_branch_1",
      "x": 1550,
      "y": 200,
      "width": 120,
      "height": 15,
      "type": "passthrough",
      "material": "wood"
    },
    {
      "id": "willow_branch_2",
      "x": 1700,
      "y": 250,
      "width": 120,
      "height": 15,
      "type": "passthrough",
      "material": "wood"
    },
    {
      "id": "path_end",
      "x": 1900,
      "y": 100,
      "width": 500,
      "height": 50,
      "type": "solid",
      "material": "stone"
    }
  ],
  "checkpoints": [
    {
      "id": "cottage_hearth",
      "x": 150,
      "y": 130,
      "isStart": true
    },
    {
      "id": "bridge_mid",
      "x": 1050,
      "y": 130
    }
  ],
  "enemies": [],
  "collectibles": [
    {
      "id": "shard_cottage",
      "type": "shard",
      "x": 250,
      "y": 150,
      "value": 1
    },
    {
      "id": "shard_fence",
      "type": "shard",
      "x": 475,
      "y": 200,
      "value": 1
    },
    {
      "id": "shard_branch",
      "type": "shard",
      "x": 1610,
      "y": 250,
      "value": 1
    },
    {
      "id": "secret_willow",
      "type": "secret",
      "x": 1760,
      "y": 300,
      "value": 5
    }
  ],
  "triggers": [
    {
      "id": "intro_cutscene",
      "x": 50,
      "y": 100,
      "width": 100,
      "height": 200,
      "type": "cutscene",
      "once": true,
      "data": {
        "cinematicId": "intro_cinematic"
      }
    },
    {
      "id": "tutorial_movement",
      "x": 350,
      "y": 100,
      "width": 100,
      "height": 200,
      "type": "tutorial",
      "once": true,
      "data": {
        "message": "Use arrow keys or touch controls to move",
        "highlight": "movement"
      }
    },
    {
      "id": "tutorial_jump",
      "x": 550,
      "y": 100,
      "width": 100,
      "height": 200,
      "type": "tutorial",
      "once": true,
      "data": {
        "message": "Press SPACE or the jump button to leap",
        "highlight": "jump"
      }
    },
    {
      "id": "chapter_complete",
      "x": 2200,
      "y": 100,
      "width": 100,
      "height": 200,
      "type": "event",
      "data": {
        "event": "chapter_complete",
        "nextChapter": 1
      }
    }
  ],
  "hazards": [],
  "decorations": [
    {
      "id": "cottage",
      "type": "building",
      "x": 50,
      "y": 100,
      "layer": "background",
      "sprite": "cottage_exterior"
    },
    {
      "id": "willow_tree_1",
      "type": "tree",
      "x": 1500,
      "y": 100,
      "layer": "background",
      "sprite": "willow_tree"
    },
    {
      "id": "willow_tree_2",
      "type": "tree",
      "x": 1650,
      "y": 100,
      "layer": "background",
      "sprite": "willow_tree"
    },
    {
      "id": "signpost",
      "type": "prop",
      "x": 2100,
      "y": 150,
      "layer": "foreground",
      "sprite": "signpost_hearthhold"
    }
  ],
  "ambiance": {
    "music": "village_morning",
    "ambientSounds": ["birdsong", "river_gentle", "wind_light"],
    "lighting": "dawn",
    "weather": "clear"
  }
}
